uuid,ord_in_thread,author,published,title,text,language,crawled,site_url,country,domain_rank,thread_title,spam_score,main_img_url,replies_count,participants_count,likes,comments,shares,type,Neutral,,,,,,,,,,,,,,,,,,,,,,,,,,,,,,,,,,,
92841a56f9f241e8d06164ab78c68925ab0ac82b,0,,2016-11-04T15:33:00.000+02:00,"WikiLeaks: Hillary Clinton knew Saudi, Qatar were funding ISIS ‚Ä?but still took their money for Foundation","
21st Century Wire says‚Ä?
This should be the biggest revelation yet from WikiLeaks already epic email trove. Will the US media cover this story? 
Last night, in an RT Exclusive interview conducted by award-winning filmmaker John Pilger, WikiLeaks editor and founder Julian Assange described what he believes is ‚Äúthe most significant email in the whole collection.‚Ä?
WikiLeaks reveals an early 2014 email where the outgoing Secretary of State Hillary Clinton was urging John Podesta , then advisor to President Barack Obama, to ‚Äúbring pressure‚Ä?on Gulf states Saudi Arabia and Qatar, ‚Äúwhich are providing clandestine financial and logistic support to ISIL [Islamic State, IS, ISIS] and other radical Sunni groups.‚Ä?
This constitutes proof that the Clinton Foundation knowingly accepting millions of dollars in ‚Äòcharitable‚Ä?donations from the same Gulf states which both Secretary Clinton and President Obama knew were funding ISIS, Al Nusra Front (al Qaeda in Syria) and known takfiri terrorist fighting organizations. 
In addition, the Clinton‚Äôs Foundation took money from a number of other gulf monarchies: 
(Infographic: Conservative Post ) 
This latest news validates what 21WIRE has been saying since the ‚ÄòISIS crisis‚Ä?began in June 2014. 
According to FOX News , FBI sources have said that ‚Äòindictments are likely‚Ä?for the Clinton Foundation investigation. One only wonders how this latest Assange revelation will factor into the wider investigation ‚Ä?as it goes right to the heart of the national security and foreign policy ‚Ä?two things which Clinton trades heavily on in her campaigning. 
Assange went on to explain the deep ramifications of this latest criminal allegation against Clinton and her family foundation: 
‚ÄúAll serious analysts know, and even the US government has agreed, that some Saudi figures have been supporting ISIS and funding ISIS, but the dodge has always been that it is some ‚Äúrogue‚Ä?princes using their oil money to do whatever they like, but actually the government disapproves. But that email says that it is the government of Saudi Arabia, and the government of Qatar that have been funding ISIS.‚Ä?
During their 25-minute interview filmed at the Ecuadorian Embassy in London, Assange and Pilger discussed the obvious conflict of interest between Clinton as Secretary of State, the Clinton Foundation and Gulf monarchies who financed them. The following is an excerpt from the interview transcript: 
John Pilger: The Saudis, the Qataris, the Moroccans, the Bahrainis, particularly the first two, are giving all this money to the Clinton Foundation, while Hillary Clinton is secretary of state, and the State Department is approving massive arms sales, particularly Saudi Arabia. 
Julian Assange: Under Hillary Clinton ‚Ä?and the Clinton emails reveal a significant discussion of it ‚Ä?the biggest-ever arms deal in the world was made with Saudi Arabia: more than $80 billion. During her tenure, the total arms exports from the US doubled in dollar value. 
JP: Of course, the consequence of that is that this notorious jihadist group, called ISIL or ISIS, is created largely with money from people who are giving money to the Clinton Foundation? 
JA: Yes. 
Watch a brief preview of the interview here: 
The interview will air in full on RT International this Saturday Nov 5th. 
READ MORE CLINTON NEWS AT: 21st Century Wire Clinton Files 
SUPPORT 21WIRE ‚Ä?SUBSCRIBE & BECOME A MEMBER @21WIRE.TV ",english,2016-11-05T04:46:01.202+02:00,21stcenturywire.com,US,,"WikiLeaks: Hillary Clinton knew Saudi, Qatar were funding ISIS ‚Ä?but still took their money for Foundation",0,http://i2.wp.com/21stcenturywire.com/wp-content/uploads/2016/11/ISIS_Clinton-Foundation.jpg?fit=610%2C415,0,0,0,0,0,conspiracy,Negative,,,,,,,,,,,,,,,,,,,,,,,,,,,,,,,,,,,
86bf9b50cfecaeb861219f63245d4c71d345438e,0,,2016-11-04T14:30:00.000+02:00,Hillary Clinton Jumps the Shark with ‚ÄòTrump‚Äôs Secret Russian Server‚Ä?Conspiracy Theory,"
21st Century Wire says‚Ä?
Yesterday, WikiLeaks editor and founder Julian Assange confirmed what 21WIRE already knew ‚Ä?that Hillary Clinton and the Obama White House‚Äôs claim of the US election process being ‚Äúhacked by the Russian government‚Ä?was a desperate work of fiction. Not content with that fish tale, Hillary Clinton took the narrative to an embarrassing new low (if that was even possible) with another, wilder made-up conspiracy story about the Russians. 
The following statement made by Hillary Clinton yesterday epitomizes the term ‚Ä?jumping the shark ‚Ä? It's time for Trump to answer serious questions about his ties to Russia. https://t.co/D8oSmyVAR4 pic.twitter.com/07dRyEmPjX 
‚Ä?Hillary Clinton (@HillaryClinton) October 31, 2016 
Apparently, Hillary Clinton‚Äôs campaign staff fed her a planted online news story (by the Clinton campaign?) which ran on a questionable pro-Democratic Party online news outlet. On Monday, the Slate ran the story by one of its alleged ‚Äújournalists‚Ä?named Franklin Foer , complete with a clickbait blog-like headline, ‚ÄúWas a Trump Server Communicating With Russia?‚Ä?
Whatever legitimacy the Slate had before last night, just evaporated. 
John Roberts from Forbes explains, ‚ÄúThe bottom line is that Slate screwed up by publishing this in the first place, and by adding more kooky misinformation to an already addled election season. As for Foer, he says on Twitter a ‚Äúfollow up‚Ä?piece is in the works.‚Ä?
Roberts rightly points out that the only follow-up story for this lemon should start with the word ‚ÄúRETRACTION.‚Ä?
CYBER FEUD: Assange believes Clinton has gone beyond the pale with her Russian conspiracy obsession. 
During his exclusive interview with award-winning filmmaker John Pilger, when asked what he thought of Hillary Clinton‚Äôs shrill antics, Julian Assange said, ‚Ä?‚ÄúI actually feel quite sorry for Hillary Clinton as a person, because I see someone who is eaten alive by their ambitions, tormented literally to the point where they become sick.‚Ä?
The saddest thing about this and the other dishonest and destructive actions of the Clinton campaign and the Democratic Party ‚Ä?is that no one in the party seems to see anything wrong with this level of deceit and dishonesty. Like Hillary Clinton in her sociopathic path to power, the party rank and file are acting like a cult coven following their high priestess. 
Still, Clinton surrogates in the media are trying to equate Clinton simultaneously scapegoating and baiting another nuclear superpower ‚Ä?with a decade-old misogynist hot mic audio excerpt of Donald Trump in a TMZ-style tabloid sting. That pretty much sums up Democratic Party strategy for this election season. 
Assange was right. Clinton, the Democratic Party and their surrogate, are eating themselves. Such are the spoils of power in Washington that men and women will do and say anything to have it. 
READ MORE ELECTION NEWS AT: 21st Century Wire 2016 Files 
SUPPORT 21WIRE ‚Ä?SUBSCRIBE & BECOME A MEMBER @21WIRE.TV ",english,2016-11-05T04:46:01.987+02:00,21stcenturywire.com,US,,Hillary Clinton Jumps the Shark with ‚ÄòTrump‚Äôs Secret Russian Server‚Ä?Conspiracy Theory,0.417,http://i0.wp.com/21stcenturywire.com/wp-content/uploads/2016/11/1-Hillary-jump-the-shark.jpg?fit=610%2C415,0,0,0,0,0,conspiracy,Negative,,,,,,,,,,,,,,,,,,,,,,,,,,,,,,,,,,,
e4c1a7542c447d908a878fd429fef0f5cf9130d4,0,,2016-11-06T07:48:00.000+02:00,Prof Michel Chossudovsky discusses Hillary Clinton‚Äôs foreign policy & emerging nuclear risks,"
21st Century Wire says‚Ä?
Amid great mainstream media and Democratic Party fanfare, Hillary Clinton‚Äôs candidacy has been based on a claim she is ‚Äúmost experienced‚Ä?candidate in history, and highlighting her foreign policy record in particular. What would a Clinton foreign policy really look like? 
On Episode #158 of the SUNDAY WIRE, host Patrick Henningsen spoke with a special guest, Professor Michel Chossudovsky , founder & editor of www.globalresearch.ca about ‚ÄòHillary‚Äôs hawks‚Ä?and what a Clinton presidency will look like in terms of US-backed wars around the globe, as well as Washington‚Äôs current fetish with ‚Äòsustainable‚Ä?nuclear conflicts. 
Listen to this excellent discussion: 
. 
READ MORE ELECTION NEWS AT: 21st Century Wire 2016 Files 
SUPPORT 21WIRE ‚Ä?SUBSCRIBE & BECOME A MEMBER @21WIRE.TV ",english,2016-11-07T01:29:27.768+02:00,21stcenturywire.com,US,,Prof Michel Chossudovsky discusses Hillary Clinton‚Äôs foreign policy & emerging nuclear risks,0.983,http://i1.wp.com/21stcenturywire.com/wp-content/uploads/2016/11/1-hillary-russia-hawk-nuke-.jpg?fit=610%2C415,0,0,0,0,0,conspiracy,Neutral,,,,,,,,,,,,,,,,,,,,,,,,,,,,,,,,,,,
4dc9f03b3aadbffd2c7cb6432b6247b3d742d55d,0,,2016-11-11T13:52:00.000+02:00,"‚ÄòBeyonce, Jay Z, Hillary Clinton ‚Ä?You Don‚Äôt Represent All Blacks, Women‚Ä?,",,,,,,,,,,,,,,,,,,,,,,,,,,,,,,,,,,,,,,,,,,,,,,,,,,,
One of the great myths being spun by the establishment media was that Donald Trump had no support from women, latinos and blacks in the US. As it turned out, this was a lie propagated in a failed attempt to margnalize Republican voters and give a false impression of a liberal Democratic mandate in America. In the end Trump gathered 29% of Latinos, 9% of African Americans and 49% of college educated white women. For months, mainstream media pundits and polls insisted that all of these demographics were exclusively for Hillary Clinton. How could they have got it so wrong? ,,,,,,,,,,,,,,,,,,,,,,,,,,,,,,,,,,,,,,,,,,,,,,,,,,,
a36405a8d7d32c2192b9a9b482dcf0ebc83c62eb,0,Mike Rivero,2016-11-23T00:49:00.000+02:00,FLASHBACK - Hillary Clinton‚Äôs ‚ÄòKKK‚Ä?Smear Against Trump was Democrat Strategy,"November 21, 2016 By 21wire Leave a Comment 
William McGurn Wall Street Journal 
Let‚Äôs get this straight. Calling Hillary Clinton a ‚Äúbigot‚Ä?has reporters asking every Republican in sight if Donald Trump has gone too far. But the Clinton campaign releases a video saying Mr. Trump is the candidate of the Ku Klux Klan, and it‚Äôs all okey-dokey? 
Then again, Mr. Trump has already been likened to Hitler, Mussolini and Stalin. Small wonder there‚Äôs a collective ho-hum when Democratic vice presidential nominee Tim Kaine says Mr. Trump is peddling ‚ÄúKKK values.‚Ä?
This is what Democrats do. It didn‚Äôt start with Mr. Trump, either. For years Democrats have portrayed the GOP as one giant hate group. 
Each presidential election, the drill goes like this: 
After Republicans nominate someone, he immediately finds himself having to prove he‚Äôs not a hater ‚Ä?of African-Americans, of women, of gays, etc. 
This year Democrats added a twist. Mr. Trump, they claim, represents a break with all those decent and lovable Republicans such as Mitt Romney , John McCain and George W. Bush . Of course, this isn‚Äôt what they were saying back when these men were running for president. 
‚Ä?In 2000, for example, an NAACP ad recreated the gruesome murder of James Byrd to imply that then-Gov. Bush was sympathetic to lynching black men. Over footage of a chain being dragged by a pickup truck, Mr. Byrd‚Äôs daughter says, ‚ÄúSo when Gov. George W. Bush refused to support hate-crimes legislation, it was like my father was killed all over again.‚Ä?
‚Ä?When John McCain ran in 2008, Barack Obama warned that Republicans would scare people by saying, ‚ÄúYou know, he doesn‚Äôt look like all those other presidents on those dollar bills.‚Ä?The McCain campaign fired back, accusing Mr. Obama of playing the race card from the ‚Äúbottom of the deck.‚Ä?Funny thing: All those reporters always hearing ‚Äúdog whistles‚Ä?from Republicans somehow didn‚Äôt hear this one. 
‚Ä?In 2012, when Mitt Romney went to the NAACP and told them face-to-face about his opposition to ObamaCare, the stories were all about how he was really just trolling for the racist vote. Vice President Joe Biden put it more explicitly, telling a largely African-American audience that if Mr. Romney were to win, he‚Äôd ‚Äúput ya‚Äôll back in chains.‚Ä?
The only difference today is that Republicans now have a nominee giving as good as he gets‚Ä?,english,2016-11-23T01:36:58.899+02:00,21stcenturywire.com,US,,FLASHBACK - Hillary Clinton‚Äôs ‚ÄòKKK‚Ä?Smear Against Trump was Democrat Strategy,0,http://i2.wp.com/21stcenturywire.com/wp-content/uploads/2016/11/1-Clinton-KKK-Democratic-Party.jpg?fit=610%2C415,0,1,0,0,0,conspiracy,Negative
561b309ed5c260bb67b4a63756e20f056b7983a0,0,Mike Rivero,2016-11-24T03:37:00.000+02:00,Hillary Clinton Supporters Now Calling for a Recount of Votes in Battleground States,November 23", 2016 By 21wire Leave a Comment ,,,,,,,,,,,,,,,,,,,,,,,,,,,,,,,,,,,,,,,,,,,,,,,,,
13fc2d922a6669ef992eeb7a701646bc04839e18,0,tokyowashi (noreply@blogger.com),2016-10-28T14:03:12.156+03:00,"Roger Stone update on Stop the Steal exit poll program - Globalist establishment creating false expectation of a close race using fake polls, then rigging voting machines to meet that expectation - Nationalistic, constitutional, free-market awakening - Rothschild, Soros, Hillary's chances of stealing the US election are shrinking by the day - The whole system is rigged and exposed, and the American people are fed up - The elitist deviants are panicking","
Roger Stone: Hillary Plans to Steal Election   
Special Report: James O'Keefe and Roger Stone Join Alex Jones   ",english,2016-10-28T14:03:12.156+03:00,abeldanger.net,US,,"Roger Stone update on Stop the Steal exit poll program - Globalist establishment creating false expectation of a close race using fake polls, then rigging voting machines to meet that expectation - Nationalistic, constitutional, free-market awakening - Rothschild, Soros, Hillary's chances of stealing the US election are shrinking by the day - The whole system is rigged and exposed, and the American people are fed up - The elitist deviants are panicking",0,,0,1,0,0,0,bs,Negative,,,,,,,,,,,,,,,,,,,,,,,,,,,,,,,,,,,
32b8a10c927682a608bd3b88147c357b8807eaeb,0,tokyowashi (noreply@blogger.com),2016-10-29T15:58:39.811+03:00,FBI Weiner Probe Reopens Hillary Clinton Investigation - Clinton Foundation Pay to Play for Israeli Pork Is Not Kosher - President Trump Will Make America Great Again #MAGA,"
EXCLUSIVE #Breaking FBI Reopens Investigation! ""Hillary Caught Selling Political Favors to Israel""?   
Victurus Libertas Published on Oct 28, 2016 

The FBI was investigating Anthony Weiner and Kim Dotcom when they found the Israeli pay to play emails on Weiner's computer. It's very serious. The FBI will be charging Hillary Clinton with planning to engage in pay to play after she had won the election. It's technically treason. Weiner was bragging that he had set up the Israeli deal. HRC was to get $100 million for the Clinton Foundation, for increasing Israeli aid by double! That's $38 billion more than today! Huma Abedin helped set the deal up. 


HILLARY GOT SCHLONGED! LOOK WHAT ANTHONY WEINER JUST SHOVED RIGHT BACK IN HER FACE‚Ä?  
REPORT: INVESTIGATION INTO ANTHONY WEINER LED FBI TO NEW PROBE OF CLINTON'S EMAILS   
Donald Trump Unloads on Hillary, Huma Abedin & Anthony Weiner   
""You're a Real Scumbag, Anthony""  


Related: 

Rothschild Globalist Cartel Owns Healthless Hillary Clinton   

Clinton Foundation's Huma Abedin Has Run ""Human Trafficking in Unpaid Interns""   

Billionaire Degenerate Jeffrey Epstein's Underage Sex Slave Scandal Taints Hillary and Jeb - Clinton‚ÄìBush Pedophilia Coverup - Mossad Blackmail Influence Over Leading Politicians - Robert & Ghislaine Maxwell - Jane Doe 102 - Epstein's Sweetheart Deal: Celebrity Lawyers Alan Dershowitz, Kenneth Starr, Roy Black - ""Little St. James"": The Name of Jeffrey Epstein's ""Egg-Shaped Penis""?   

The Situation Is So Intense, It Involves the Entire US Government | FBI Insider   

*EXPLOSIVE* Q & A on the Clinton Foundation - FBI Insider on 4chan /pol/ : ""Ask Me Anything About the Clinton Case"" - George Soros Is the Kingpin - Follow the Rothschild Thread - Clinton Foundation Uses People as Currency - Jeffrey Epstein's Child Sex Trafficking Network - Bill & Hillary Clinton Get Paid in Money & Children - Hammer HRC's E-mails, Dig Into the CF: Post Everywhere You Can   ",english,2016-10-29T15:58:39.811+03:00,abeldanger.net,US,,FBI Weiner Probe Reopens Hillary Clinton Investigation - Clinton Foundation Pay to Play for Israeli Pork Is Not Kosher - President Trump Will Make America Great Again #MAGA,0,,1,1,0,0,0,bs,Negative,,,,,,,,,,,,,,,,,,,,,,,,,,,,,,,,,,,
98d6586f006a7d9ffeaf9f8d70962201a9b08df1,0,tokyowashi (noreply@blogger.com),2016-11-01T00:49:25.485+02:00,Why Hillary Clinton's Campaign Is Collapsing | True News,"
",english,2016-11-01T00:49:25.485+02:00,abeldanger.net,US,,Why Hillary Clinton's Campaign Is Collapsing | True News,0,,0,1,0,0,0,bs,Negative,,,,,,,,,,,,,,,,,,,,,,,,,,,,,,,,,,,
999af667dd0fec633e0a98865fb8d973a39fcb0a,0,tokyowashi (noreply@blogger.com),2016-11-01T09:56:04.637+02:00,Insiders Threaten to Expose Hillary's Pedophile Sex Ring!!!,"BREAKING BOMBSHELL! FBI NYPD INSIDERS LEAK - Email Scandal About to Take a SICK and TWISTED Turn    
Source: Victurus Libertas  


All of the following information was given to us by our insiders who have specific first-hand knowledge of the Hillary Clinton email scandal. It seems that things are about to heat up. We are told that of the 662,871 emails lifted from Anthony Weiner's computer, 11,112 emails are Huma Abedin's‚Ä?and pay to play ‚Ä?including Saudis and Israelis. Meaning Huma was the one Hillary USED to communicate with foreign leaders via email for inside information and deals via Huma's computer. 

It has been established through many avenues, but mainly through Wikileaks, that the Clinton Foundation was just a farce set up in order to perform pay-to-play games with multiple entities, including foreign nations. Pay-to-play nations include: Israel, Saudi Arabia, Turkey, Qatar, Kazakhstan, and the Ukraine. 
Furthermore, we are told by one of our insiders that one email unequivocally confirms ISIS was created by CIA and Israeli Secret Intelligence Service , with help from Joe Lieberman, John McCain, and Lindsey Graham! An NYPD insider said the content they viewed did include State Department TOP SECRET emails. One file was called ""Life Insurance"". A second file was titled "" DNC Nuclear Arsenal "". 

A third file I'm sure Hillary definitely DOES NOT want released was a file labeled ""Intimate"" ‚Ä?according to this NYPD insider, this file contained X-rated photos of Huma and Hillary with a TEENAGER . 

NYPD detectives were sickened by what they saw, according to our insider, and they had threatened FBI field agents that they would leak this information, if the FBI did not ""step up and take off the kid gloves"" . At that point, 13 of the FBI agents in NYC were also threatening to leak the information. 

As you can imagine, the scandal has the entire Obama Administration in full panic. We are told there are emails that could send Loretta Lynch to prison , as well as Bill and Hillary. The Twitter post below, our sources sent us, verifying it is all true: 




Even MORE! 

The following information comes straight from an FBI Anonymous source, who is the senior analyst who posted on 4chan in early July of this year: 

Jim Comey learned that some of his own investigators were tipping off both Loretta Lynch and Bill Clinton, thus making his job impossible. 

Comey sent a letter to Congress, knowing that ultimately it would expose Loretta Lynch as a dirty actor and the breadcrumbs would lead directly to Obama . The State Department is terrified now. Comey has assembled a small team of 40 agents, whom he has declared ""The Untouchables"" after the famous federal agent Eliot Ness. 

Comey has clamped down on all FBI agents and he expects a full-scale war between the FBI and the Department of Justice (DOJ), the White House, and the State Department. He has confirmed and understands that many sitting senators, congressmen, lobbyists, and power players are going to be indicted and prosecuted . One of the main targets of the probe is the Clinton Foundation and Clinton Global Initiative. Among the targets under investigation are John Podesta, Huma, Cheryl Mills, CNN, ABC, NBC, etc. 

As it turns out, Weiner, Huma's husband, had been forwarding Huma's emails each time she came home and left her computer open. Huma appears to have been in touch with Saudi actors, and therefore, ESPIONAGE is strongly suspected. 
Comey and his 40 "" Untouchables "" are now preparing to take down the largest corruption ever witnessed in American history‚Ä?which is what I think MUST happen if Comey is planning to stay part of the FBI. He lost so much respect and so much credibility with the first Hillary investigation, it would take something of this magnitude to allow him to face the public again. The Pentagon has internal players and outside players they call "" creatives "". Creatives are civilians who tend to be geniuses, malcontents, extreme hackers, or otherwise demonstrate brilliance in other useful areas. A Pentagon program called Cicada 3301 , which we have reported on previously, was created by several of these talented civilians. The program is now used to allow thousands of honest government people to report on their corrupt superiors, using what is called a DEAD BOX whistleblower encryption method so the non-corrupted government officials can report corruption and still remain safe. 

I've heard it said ""A vagina almost took down Bill, now will a Weiner take down Hillary?"" LOL! 

Again, thank you to all of the insiders, the whistleblowers, the good FBI agents, the good CIA agents, the good NYPD officers, and the non-corrupted government officials who want to see the truth exposed! Without these brave, wonderful, and morally erect individuals, our country would still be in the corrupted darkness. 



Vistors to Epstein's Little St. James Island include: 

‚Ä?Ehud Barak , the former Prime Minister of Israel (1999-2001) ‚Ä?pedophile being procured underage girls by Epstein. Former Israeli Minister of Defense and also Deputy Israeli Prime Minister under Binyamin Netanyahu from 2009 to 2013. 

‚Ä?Prince Andrew ‚Ä?British royalty ‚Ä?Jeffrey Epstein and his girlfriend Ghislaine Maxwell pimped Epstein sex slave Virginia Roberts to Prince Andrew multiple times. The victim girls say Prince Andrew was very sexually sadistic; they despised this sick, twisted creature. 

‚Ä?Kevin Spacey ‚Ä?actor in House of Cards. People tell me Spacey is gay, and my response is ""Have you ever heard of the word bisexual?"" Spacey is very good friends with 2 big-time pedophiles: Jeffrey Epstein and Bill Clinton. Spacey, big Hollywood star, has 3.78 million Twitter followers. 

‚Ä?Alan Dershowitz ‚Ä?longtime friend of Epstein, as well as one of his defense lawyers. Dershowitz was the one who negotiated that absurd plea bargain for Epstein that gave him a 13-month (served) sentence and a 16 hour/day day pass so he could spend most of his time in his mansion. Epstein sex slave Virginia Roberts has said that Epstein made her have sex with Dershowitz numerous times. The real question is how many other underage girls was Dershowitz having sex with? Virginia Roberts says Dershowitz also witnessed Epstein's pedophilic activities. 

http://victuruslibertas.com/2016/10/insiders-reveal-sex-ring/ 

Related: 

Abel Danger - ""FBI INSIDER"" - Clinton Foundation Scandal Would Bring Down the Government and More   

The Situation Is So Intense, It Involves the Entire US Government | FBI Insider   

*EXPLOSIVE* Q & A on the Clinton Foundation - FBI Insider on 4chan /pol/ : ""Ask Me Anything About the Clinton Case"" - George Soros Is the Kingpin - Follow the Rothschild Thread - Clinton Foundation Uses People as Currency - Jeffrey Epstein's Child Sex Trafficking Network - Bill & Hillary Clinton Get Paid in Money & Children - Hammer HRC's E-mails, Dig Into the CF: Post Everywhere You Can   

I SIS stands for ""Israeli Secret Intelligence Service""   ",english,2016-11-01T09:56:04.637+02:00,abeldanger.net,US,,Insiders Threaten to Expose Hillary's Pedophile Sex Ring!!!,0,,0,1,0,0,0,bs,Neutral,,,,,,,,,,,,,,,,,,,,,,,,,,,,,,,,,,,
