uuid,ord_in_thread,author,published,title,text,language,crawled,site_url,country,domain_rank,thread_title,spam_score,main_img_url,replies_count,participants_count,likes,comments,shares,type,Neutral,,,,,,,,,,,,,,,,,,,,,,,,,,,,,,,,,,,
50336fcfa54025e51c1bcf5798841f06e7332642,0,mobiusmale,2016-10-28T01:39:08.579+03:00,Forget Wikileaks...this is the real October Surprise that is going to stop Hillary,"Forget Wikileaks...this is the real October Surprise that is going to stop Hillary page: 1 link People have a hard time wading through all of the twists and turns, and convoluted political intrigue, that are the devastating stream of revelations about just how corrupt the Democratic Party...and its supreme leader Hillary Clinton...is. Most people don't have the time, or the attention span, to pour over the tens of thousands of documents being released by Wikileaks - and the MSM is trying their hardest to ignore the subject. Having said that, my father once told me that, ""There are two things you don't mess with. A man's wife, or a man's paycheque...and not necessarily in that order."" Substitute ""woman"" and ""husband"" if you like, but the message is very clear. And now...even CNN cannot ignore it...we have the issue that directly affects people's pocketbooks. Plain and simple. The pain and the impacts are very real and very personal. Obamacare Premiums... Just watch the Polls swing on this issue leading up to November 8...and watch as State after State goes from Blue to Red - just like the American peoples' bank accounts, due to the astonishing increases in Obamacare Premiums! edit on 27-10-2016 by mobiusmale because: link not working edit on 27-10-2016 by mobiusmale because: typo link a reply to: mobiusmale Most people get their insurance through their work, the next largest segment has Medicare/Medicaid. Those that get their insurance through the exchanges, not all of them are experiencing a large premium hike. The people you are talking about that are effected by these premium hikes are a small minority that won't tilt the election one way or another. But go ahead and think this will change blue states to red. link a reply to: kruphix Kinda going to spin off that, but isn't it funny that that is the argument being made by the left now? The poor and disaffected who don't get the insurance through their work (basically the people who were invoked to pass the bill) are going to, now, take the brunt of the hikes. People will vote with their wallets. Looks like the people least likely to afford it get hit the hardest. time.com... Yet it‚Äôs also true that for Americans who don‚Äôt get insurance through work, and who make too much money to qualify for federal subsidies, the cost of health coverage is about to soar dramatically, with premiums sometimes rising $1,000, even over $2,000 for the year. If one were making 45k per year and the cost of a service increased 1k-2k for THAT year one would find other service providers or not use the service at all. But if you did not pay for health insurance you would owe the irs a penalty of 2k. Damned if you do Damned if you do not. 5% of someones income is alot, enough to make them think about who to vote for. a reply to: kruphix I am 27, never get ill, have low blood pressure, and am in good shape. My premiums doubled since this mess. So I ditched it. This was a redistribution of health care. link I don't understand why Trump hasn't been all over this opportunity. He should stop with the nonsense shooting himself in the foot crap and focus on this news to sway more voters to his side. Instead he has been babbling about his awesome golf course. It is times like these that make me think he must be taking a dive on purpose. originally posted by: Mr Headshot a reply to: kruphix Kinda going to spin off that, but isn't it funny that that is the argument being made by the left now? The poor and disaffected who don't get the insurance through their work (basically the people who were invoked to pass the bill) are going to, now, take the brunt of the hikes. Of course they will because they're the ones on the exchanges. One thing Hillary would like to do is provide more federal funding to get younger people signed up, to lower the risk pool and in turn lower premiums. Of course, the Republicans won't work with her on it because ""OBAMACARE,"" so who knows. I guess everyone is holding out for single payer, which is the inevitable result once the insurance industry collapses under the high cost of medical treatment. link a reply to: kruphix The people you are talking about that are effected by these premium hikes are a small minority that won't tilt the election one way or another. Yeah the people in the ""basket of deplorables"" are a small minority as well. Perhaps in your opinion they are all in the same basket. Nice to be told ""you're a amall minority"" your fate won't effect an election. originally posted by: kruphix a reply to: mobiusmale Most people get their insurance through their work, the next largest segment has Medicare/Medicaid. Those that get their insurance through the exchanges, not all of them are experiencing a large premium hike. The people you are talking about that are effected by these premium hikes are a small minority that won't tilt the election one way or another. But go ahead and think this will change blue states to red. cool, then abolishing the abortion that is ""Obamacare"" should be quick and easy. Then we can get insurance companies back to competing for our business and maybe get insurance back to where most people can afford it and not just those making less than $23k a year. You do realize that Obamacare is the single biggest failure in the history of the US last 8 years right? Much like a monkey #ing a football. link a reply to: mobiusmale It's going to cost Hilary some votes but is NOT going turn a blue state red. Might sway a poorer purple one toward red, but I'm unsure of what state fits that bill exactly. Fl maybe? a reply to: Greggers Of course, the Republicans won't work with her on it because ""OBAMACARE,"" so who knows. ""Work with her""? really kind of like the dems worked with the gop to pass the ACA to begin with? Pass it before you read it? Like your plan keep your plan? That kind of cooperation? originally posted by: kruphix a reply to: mobiusmale Most people get their insurance through their work, the next largest segment has Medicare/Medicaid. Those that get their insurance through the exchanges, not all of them are experiencing a large premium hike. The people you are talking about that are effected by these premium hikes are a small minority that won't tilt the election one way or another. But go ahead and think this will change blue states to red. Considering you're talking about small and medium business owners who the current administration (and HRC) says they want to support, I am fairly certain the OP is accurate. The price hikes are a direct slap in the face to those of us that own our own small businesses and pay for insurance on our own. Shows how out of touch the top is with the middle. Employer sponsored rates are high too. It's cutting into employees' pay. Wake up voters !!! originally posted by: Mr Headshot a reply to: kruphix Kinda going to spin off that, but isn't it funny that that is the argument being made by the left now? The poor and disaffected who don't get the insurance through their work (basically the people who were invoked to pass the bill) are going to, now, take the brunt of the hikes. Of course they will because they're the ones on the exchanges. One thing Hillary would like to do is provide more federal funding to get younger people signed up, to lower the risk pool and in turn lower premiums. Of course, the Republicans won't work with her on it because ""OBAMACARE,"" so who knows. I guess everyone is holding out for single payer, which is the inevitable result once the insurance industry collapses under the high cost of medical treatment. yes, the young ones who are also making minimum wage or close. If they make any money at all, they will miss the subsidies and be paying the $500 to $800 a month the rest of us have to pay. The way it was before Obamacare was much much better for everyone except the one's with pre-existing conditions. It's a shame we couldn't have someone who was smart enough to grasp that. Then they could have just tried to fix that tiny slice of the population instead of jamming a broomstick up the rest of us. originally posted by: Mr Headshot a reply to: kruphix Kinda going to spin off that, but isn't it funny that that is the argument being made by the left now? The poor and disaffected who don't get the insurance through their work (basically the people who were invoked to pass the bill) are going to, now, take the brunt of the hikes. Of course they will because they're the ones on the exchanges. One thing Hillary would like to do is provide more federal funding to get younger people signed up, to lower the risk pool and in turn lower premiums. Of course, the Republicans won't work with her on it because ""OBAMACARE,"" so who knows. I guess everyone is holding out for single payer, which is the inevitable result once the insurance industry collapses under the high cost of medical treatment. ""More Federal Funding"" is just code for, ""we are going to increase taxes""...so Hillary's solution for high Health insurance Premiums, is to move the taxpayer drain a little farther to left and call it something else. I mean what choice would she have, if she wants to keep some semblance of this disaster intact? The Obama/Clinton regime doubled the National Debt to over $20 trillion dollars in 8 yearts...how much deeper can that go before the whole bubble bursts? a reply to: Vasa Croe The price hikes are a direct slap in the face to those of us that own our own small businesses and pay for insurance on our own. That's right they forgot if you have less than 50 people employed you do not have to provide insurance to your employees. originally posted by: Mr Headshot a reply to: kruphix Kinda going to spin off that, but isn't it funny that that is the argument being made by the left now? The poor and disaffected who don't get the insurance through their work (basically the people who were invoked to pass the bill) are going to, now, take the brunt of the hikes. Of course they will because they're the ones on the exchanges. One thing Hillary would like to do is provide more federal funding to get younger people signed up, to lower the risk pool and in turn lower premiums. Of course, the Republicans won't work with her on it because ""OBAMACARE,"" so who knows. I guess everyone is holding out for single payer, which is the inevitable result once the insurance industry collapses under the high cost of medical treatment. And where exactly does federal funding come from? *looks at wallet* No such thing as a free lunch. My healthcare costs have gone up almost 50% while benefits have gone down, and I'm on an employer provided plan. I'm 33yo and healthy as a horse. Healthcare is not a right, quit treating it as such. Get some actual competition in the system as well as some tort reform and maybe you'll see some improvement. Start jailing cronies and letting unprofitable companies fail you'll see some improvement. I feel sorry for anyone who believes that Democrats/Republicans are one dimes worth of different from each other... edit on 10-27-2016 by cynicalheathen because: (no reason given)",english,2016-10-28T01:39:08.579+03:00,abovetopsecret.com,US,18533,Forget Wikileaks...this is the real October Surprise that is going to stop Hillary,0,http://files.abovetopsecret.com/images/ats5.jpg,0,1,0,0,0,bs,Negative,,,,,,,,,,,,,,,,,,,,,,,,,,,,,,,,,,,
7facacd9a551b14017784d720f1eaf9647946ec9,0,ghostrager,2016-10-27T22:45:00.000+03:00,Hillary Conquers 2 Steps with Little Help,"Hillary Conquers 2 Steps with Little Help page: 1 link She has again conquered a flight of stairs, well 2 steps, with little help. As you can see in the video she takes the first step with ease as her helper rushes to her side just in time. The next step was larger and she glances back knowing a lending hand is there. He gives her a boost and she proudly, albeit ironically, holds up her ""Stronger Together"" sign. Political Mudpit seems like a good spot for this. With how Presidents age in office, how much is she going to deteriorate over the next 4 years? Ghost I though she was about to perform a pole dance. (post by paradoxious removed for a serious terms and conditions violation) link What with all of the time she spends off of the campaign trail, you would think she could spend a little time in the gym, working on her leg strength. And I know, given all of the ""speech money"" she and Bill have socked away, she can afford to hire a personal trainer... link a reply to: mobiusmale What with all of the time she spends off of the campaign trail, you would think she could spend a little time in the gym, working on her leg strength. And cut into her 16 hours of sleep and naps per day? Not likely. link originally posted by: ghostrager Could it just be that the second step was a little higher up and she needed some help? Or maybe theven gentleman that is supposed to be by her side was just being a gentleman. Good thing Franklin D. Roosevelt isn't running in the US today. don't fool yourself, ol frank was in some deep pockets to. And cut into her 16 hours of sleep and naps per day? Not likely. I had heard it was 18 hours. Good thing Franklin D. Roosevelt isn't running in the US today. don't fool yourself, ol frank was in some deep pockets to. In this case it was about steps, not which pocket. There all in some pocket even if it isn't about money. link a reply to: roadgravel frank also tried to hide the extant his disability from the public as best he could. sounds very familiar to me. link Her, age in office? We're talking about the grim reaper here. Who's already been in cahoots with other elites and has been in the game completely giving zero f***s about anything except power. Anyway, the video didn't really deliver. She is wearing heels, so that's enough to valid needing a hand assist. Enough to be a non story, and discredit her real concerning health issues as far reach. On another note, she's horrendous. Her greeting the crowd wooing looking like someone who's high as hell in lala land tripping on acid etc. Let's not talk further about her joker smile.",english,2016-10-28T01:39:15.467+03:00,abovetopsecret.com,US,18533,Hillary Conquers 2 Steps with Little Help,0,http://files.abovetopsecret.com/images/ats2.jpg,0,1,0,0,0,bs,Neutral,,,,,,,,,,,,,,,,,,,,,,,,,,,,,,,,,,,
5728857f1236aa78f8ddac7e5175bf3c99461154,0,xuenchen,2016-10-28T02:09:15.029+03:00,Goldman Sachs Endorses Hillary Clinton For President,"Well finally we have the big global Business/Bank Goldman Sachs officially endorsing Hillary Clinton for President !! They have been giving her money and paying for speeches for some time now. Get ready for Hillary's *actual* policies to kick in if and when she gets elected. Ironic. GS has been a target of political activism for years. Now they can bank on Hillary protecting them. Goldman Sachs Endorses Hillary Clinton For President He‚Äôs with her. On Sunday, former Secretary of State Hillary Clinton earned the endorsement of Goldman Sachs CEO Lloyd Blankfein‚Äîan endorsement she had been working toward for years. As was revealed by Wikileaks, Hillary Clinton spent the run up to her presidential campaign giving speeches to Goldman Sachs and other Wall Street banks, where she praised their talents and explained her positions on financial regulation. On October 24, 2013, Clinton told Goldman Sachs that Dodd-Frank had to be done mostly for ‚Äúpolitical reasons‚Ä?because Congress needed to look like it was doing something about the crisis. She said, ‚ÄúThere‚Äôs nothing magic about regulations, too much is bad, too little is bad. How do you get to the golden key, how do we figure out what works? And the people that know the industry better than anybody are the people who work in the industry.‚Ä?The anti-Bernie anti-Thesis",english,2016-10-28T02:09:15.029+03:00,abovetopsecret.com,US,18533,Goldman Sachs Endorses Hillary Clinton For President,0,http://files.abovetopsecret.com/images/ats11.jpg,0,1,0,0,0,bs,Negative,,,,,,,,,,,,,,,,,,,,,,,,,,,,,,,,,,,
2fc939186376c9fc90cda08707b212bada66fb9f,0,CriticalStinker,2016-10-28T06:57:12.283+03:00,Assange - Hillary will win and tried to hack Wikileaks,"link So this is from an Argentinian conference Assange spoke with via telephone. He states Hillary campaign (or pro-Hillary government) attempted to attack Wikileaks servers. Assange claimed the release ‚Äúwhipped up a crazed hornet‚Äôs nest atmosphere in the Hillary Clinton campaign‚Ä?leading them to attack WikiLeaks. ‚ÄúThey attacked our servers and attempted hacking attacks and there is an amazing ongoing campaign where state documents were put in the UN and British courts to accuse me of being both a Russian spy and a pedophile,‚Ä?he added. He also added that he does not think the Podesta emails will have an impact, adding the influence of MSM pushing Hillary. The Podesta emails will make no difference to the election result, according to Assange. ‚ÄúI don‚Äôt think there‚Äôs any chance of Donald Trump winning the election, even with the amazing material we are publishing, because most of the media organizations are strongly aligned with Hillary Clinton,‚Ä?he said. sorry this is RT, but many won't cover this Interesting considering he implied he would have a bombshell before the election. This whole situation is so hard to read, with talks of Wikileaks being compromised, or pressure on to Ecuador trickling down to Assange. Just thought I'd share.",english,2016-10-28T06:57:12.283+03:00,abovetopsecret.com,US,18533,Assange - Hillary will win and tried to hack Wikileaks,0,http://files.abovetopsecret.com/images/ats13.jpg,0,1,0,0,0,bs,Negative,,,,,,,,,,,,,,,,,,,,,,,,,,,,,,,,,,,
95326a4ff163ca27f2185f6450b56e1e5c0abb4f,0,Violater1,2016-10-28T06:57:18.062+03:00,Is google and YouTube in the Hillary's purse?,"Is google and YouTube in the Hillary‚Äôs purse? page: 1 link After I posted my opening post (OP) on ‚ÄúHillary Clinton Wants a Strong Russia. Wait, what did she say?‚Ä?, mysteriously, my YouTube account gets wiped out. The next thing I notice, is that the youtube video that I used in my OP, www.abovetopsecret.com... suddenly won‚Äôt work. Has anyone else experienced this bizarre behavior before? Is this what we are to expect if Hillary becomes POTUS? I went to the Youtube site and the video is available. www.youtube.com... I frankly, don't know what to think about this. link a reply to: Violater1 yes, so is almost all the major media, magazines (that are left), most of hollywood, GOP kinda, most of the bush's. Who else? Google is pro clinton like drudge is pro trump without a doubt Just about every news story under google news is pro hillary and negative towards trump. If I recall correctly they even advice her campaign edit on 511031America/ChicagoThu, 27 Oct 2016 21:51:09 -05 p3142 by interupt42 because: (no reason given) Is the dead link the same as the good one in the following reply? Same vid#? No errors? link I'm getting the feeling that the gun control,Hillary as dictator,is not unlike Obamacare,forced on us,this is socialism and being the Corporations own the candidates,they want this we have no choice,they have the UN,plus a bunch of immigrants to join the UN forces to attack the american freedom fighters,you may think I'm crazy but they said I was crazy when I said 9/11 was a controlled demolition,look at the past,put common sense to it,the big ball is rolling,too much money at stake here thats the goal rich get richer,no more middle class,upper middle class,those making like 1 or 2 million a year,will be joining the crowd,unless your a member of the party,Known many an immigrant who lived under communist rule,all storys kind of same,all bad,no sense of identity",english,2016-10-28T06:57:18.062+03:00,abovetopsecret.com,US,18533,Is google and YouTube in the Hillary's purse?,0,http://files.abovetopsecret.com/images/ats6.jpg,0,1,0,0,0,bs,Neutral,,,,,,,,,,,,,,,,,,,,,,,,,,,,,,,,,,,
b7e15736ee03db55ed797b6f3d72e899615187b9,0,carewemust,2016-10-28T06:57:18.127+03:00,MEDIA SHAME - These 65 Journalists are Now Presstitutes. Their Madam is Hillary Clinton.,"originally posted by: carewemust October 27, 2016 It's a disgrace that such prominent media people, like Wolf Blitzer, George Stephanopoulos, John King, Et al., are willing to go before millions of viewers, and shamelessly report what Hillary's campaign tells them to report. Story w/List of 65 Corrupt Journalists: thefreethoughtproject.com... It's always been obvious that CNN-MSNBC-NBC-ABC in particular, go out of their way to HELP Hillary Clinton and HURT Donald Trump. Now, thanks to the Podesta e-mails provided by WikiLeaks, we can see ""behind the curtain"". If mentally imbalanced Hillary becomes President, imagine the leverage she will have, to bring groups, organizations, companies, and people to their knees, if she doesn't like them! -CareWeMust Those news channels have always been Democrat. Newspapers over 100 years have picked a side and given a slant. You just notice this now? edit on 27-10-2016 by reldra because: (no reason given)",english,2016-10-28T06:57:18.127+03:00,abovetopsecret.com,US,18533,MEDIA SHAME - These 65 Journalists are Now Presstitutes. Their Madam is Hillary Clinton.,0,http://files.abovetopsecret.com/images/ats17.jpg,0,1,0,0,0,bs,Negative,,,,,,,,,,,,,,,,,,,,,,,,,,,,,,,,,,,
157eba53c234d2695ec95783e1f5547a853d0d8c,0,Activist Post,2016-10-29T22:20:10.208+03:00,FBI Reopens Hillary Email Probe: Why Did It Take So Long?,By Jon Rappoport File this one under: ‚ÄúCome on. Really?‚Ä?The elephant in the room: HOW LONG HAS THE FBI KNOWN that new Hillary emails... ,english,2016-10-29T22:20:10.208+03:00,activistpost.com,US,37161,FBI Reopens Hillary Email Probe: Why Did It Take So Long?,0,,0,1,0,0,0,conspiracy,Negative,,,,,,,,,,,,,,,,,,,,,,,,,,,,,,,,,,,
3bd561303ff1ea6176476fb1be4596520c054b0a,0,Activist Post,2016-11-01T18:26:34.857+02:00,"Not Just Hillary, Entire Obama Administration Exposed for Using Private Email to Avoid FOIA Requests",By Jack Burns WikiLeaks is helping President Obama keep his 2008 campaign promise ‚Ä?to be the most transparent administration in U.S. history ‚Ä?whether he likes... ,english,2016-11-01T18:26:34.857+02:00,activistpost.com,US,37161,"Not Just Hillary, Entire Obama Administration Exposed for Using Private Email to Avoid FOIA Requests",0,,0,1,0,0,0,conspiracy,Negative,,,,,,,,,,,,,,,,,,,,,,,,,,,,,,,,,,,
9e39d77d6c7452b27e250ff9e9bb82bea9398a63,0,Activist Post,2016-11-08T17:45:20.893+02:00,No Matter Who Wins: The Case Against Hillary Clinton Is Alive,"By Jon Rappoport Follow the bouncing ball. It turns out that several money bundlers for Hillary Clinton‚ÄîFredrick D. Schaufeld, Karen Schaufeld, Sonjia Smith, Michael Bills‚Ä?.. ",english,2016-11-08T17:45:20.893+02:00,activistpost.com,US,37161,No Matter Who Wins: The Case Against Hillary Clinton Is Alive,0,,0,1,0,0,0,conspiracy,Negative,,,,,,,,,,,,,,,,,,,,,,,,,,,,,,,,,,,
f728265dae1b66efae24134da7a5fce4a5d839c3,0,Activist Post,2016-11-09T02:00:47.984+02:00,Proof That 100 Years of Voting for the ‚ÄúLesser Evil‚Ä?Gave Us Trump and Hillary,"Op-Ed by Carey Wedler As millions of Americans head to the polls today to ‚Äúhave their voices heard‚Ä?and ‚Äúmake a difference,‚Ä?many will likely... ",english,2016-11-09T02:00:47.984+02:00,activistpost.com,US,37161,Proof That 100 Years of Voting for the ‚ÄúLesser Evil‚Ä?Gave Us Trump and Hillary,0,,0,1,0,0,0,conspiracy,Negative,,,,,,,,,,,,,,,,,,,,,,,,,,,,,,,,,,,
