uuid,ord_in_thread,author,published,title,text,language,crawled,site_url,country,domain_rank,thread_title,spam_score,main_img_url,replies_count,participants_count,likes,comments,shares,type,Neutral,,,,,,,,,,,,,,,,,,,,,,,,,,,,,,,,,,,
c70e149fdd53de5e61c29281100b9de0ed268bc3,0,Barracuda Brigade,2016-10-31T01:41:49.479+02:00,BREAKING: Weiner Cooperating With FBI On Hillary Email Investigation,"Red State : 
Fox News Sunday reported this morning that Anthony Weiner is cooperating with the FBI, which has re-opened (yes, lefties: ‚Äúre-opened‚Ä? the investigation into Hillary Clinton‚Äôs classified emails. Watch as Chris Wallace reports the breaking news during the panel segment near the end of the show: 
And the news is breaking while we‚Äôre on the air. Our colleague Bret Baier has just sent us an e-mail saying he has two sources who say that Anthony Weiner, who also had co-ownership of that laptop with his estranged wife Huma Abedin, is cooperating with the FBI investigation, had given them the laptop, so therefore they didn‚Äôt need a warrant to get in to see the contents of said laptop. Pretty interesting development. 
Targets of federal investigations will often cooperate, hoping that they will get consideration from a judge at sentencing. Given Weiner‚Äôs well-known penchant for lying, it‚Äôs hard to believe that a prosecutor would give Weiner a deal based on an agreement to testify, unless his testimony were very strongly corroborated by hard evidence. But cooperation can take many forms ‚Ä?and, as Wallace indicated on this morning‚Äôs show, one of those forms could be signing a consent form to allow   the contents of devices that they could probably get a warrant for anyway. We‚Äôll see if Weiner‚Äôs cooperation extends beyond that. More Related",english,2016-10-31T01:41:49.479+02:00,100percentfedup.com,US,25689,BREAKING: Weiner Cooperating With FBI On Hillary Email Investigation,0,http://bb4sp.com/wp-content/uploads/2016/10/Fullscreen-capture-10302016-60437-PM.bmp.jpg,0,1,0,0,0,bias,Negative,,,,,,,,,,,,,,,,,,,,,,,,,,,,,,,,,,,
8f30f5ea14c9d5914a9fe4f55ab2581772af4c31,0,Barracuda Brigade,2016-11-02T16:31:28.550+02:00,Hillary Goes Absolutely Berserk On Protester At Rally! (Video),"Print Hillary goes absolutely berserk! She explodes on Bill ‚Äòrapist‚Ä?protester at rally‚Ä?Oh the irony! She is an enabler to Bill‚Äôs ‚Äúescapades‚Ä? She‚Äôs is just projecting again. She is so pathetic. Dragging integrity challenged Alicia Machado on stage with her yesterday at her sad little ‚Äúrally‚Ä?in Florida. 
TGP : Democratic Party presidential nominee Hillary Clinton angrily reacted to a protester shouting ‚ÄúBill Clinton is a rapist‚Ä?at a campaign rally in Fort Lauderdale, Florida Tuesday night, saying, ‚ÄúI am sick and tired of the negative, dark, divisive, dangerous vision and behavior of people who support Donald Trump,‚Ä?according to reports. 
Protester interrupts Hillary Clinton shouting ""Bill Clinton is a rapist."" Clinton fires right back ""I am sick and tired of the negative"" pic.twitter.com/yncdkS90Bg 
‚Ä?Josh Haskell (@joshbhaskell) November 2, 2016 Man interrupts @HillaryClinton yelling ""Bill Clinton is a rapist""- she responds she's tired of divisive distractions. @nbc6 pic.twitter.com/2GPjps1EQB 
‚Ä?Jamie Guirola (@jamieNBC6) November 2, 2016 Here's Hillary absolutely going bezerk on a protester, starts screaming, shouting, yelling. Full off the rails. pic.twitter.com/j11qI5JjtO 
‚Ä?John Binder üëΩ (@JxhnBinder) November 2, 2016 Related",english,2016-11-02T16:31:28.550+02:00,100percentfedup.com,US,25689,Hillary Goes Absolutely Berserk On Protester At Rally! (Video),0,http://bb4sp.com/wp-content/uploads/2016/11/Fullscreen-capture-1122016-74311-AM.bmp.jpg,0,1,0,0,0,bias,Neutral,,,,,,,,,,,,,,,,,,,,,,,,,,,,,,,,,,,
a19aabaa5a61eb8bc22fadaaa003e5fbba5c4bf6,0,Fed Up,2016-11-06T23:54:00.000+02:00,BREAKING: CLINTON CLEARED...Was This A Coordinated Last Minute Trick To Energize Hillary's Base? ¬ª 100percentfedUp.com,"
Limbaugh said that the revelations in the Wikileaks material were ‚Äústarting to hurt‚Ä?the Clintons and that the renewed interest in an FBI investigation into her private email server would be a fruitless distraction. 
In any case‚Ä?
IT‚ÄôS TIME TO DRAIN THE SWAMP! 
FBI Director James Comey said Sunday that the agency has reviewed all of the Hillary Clinton emails recently discovered in an unrelated case and that his conclusion in July not to prosecute Clinton after the FBI‚Äôs original investigation into her use of private email server still stands. 
Comey informed Congress on Oct. 28 that the agency would, in the unrelated case, review additional emails related to Clinton‚Äôs time running the State Department from 2009 to 2013. 
‚ÄúSince my letter, the FBI investigative team has been working around the clock to process and review a large volume of emails,‚Ä?Comey said Sunday in a follow-up letter to Congress. ‚ÄúDuring that time we reviewed all of the communications that were to or from Hilary Clinton as secretary of state. Based on our review, we have not changed our conclusion.‚Ä?
The new case is purportedly related to ex-New York Democratic Rep. Anthony Weiner using a laptop he shared with estranged wife and top Clinton aide Huma Abedin for ‚Äúsexting‚Ä?an apparently underage female. 
",english,2016-11-07T10:20:06.409+02:00,100percentfedup.com,US,25689,BREAKING: CLINTON CLEARED...Was This A Coordinated Last Minute Trick To Energize Hillary's Base? ¬ª 100percentfedUp.com,0.144,http://100percentfedup.com/wp-content/uploads/2016/05/hillary-comey.jpg,0,0,0,0,0,bias,Neutral,,,,,,,,,,,,,,,,,,,,,,,,,,,,,,,,,,,
f54d8e13010d0a79893995ee65360ad4b38b5a35,0,Fed Up,2016-11-07T02:43:00.000+02:00,"EVIL HILLARY SUPPORTERS Yell ""F*ck Trump""‚Ä¶Burn Truck Of Daddy Fishing With 2 Yr Son Over Of Trump Bumper-Stickers [VIDEO] ¬ª 100percentfedUp.com","Email 
These people are sick and evil. They will stop at NOTHING to get their way. Laws mean nothing to them, because they mean nothing to their President and his regime‚Ä?
A California man says a stranger hurled expletives and set his truck on fire Thursday after seeing a pro-Donald Trump sticker on the bumper. 
Hao Lee had taken his 2-year-old son fishing on a pleasant November afternoon in Sacramento. He parked his white Dodge Ram truck with a pair of Trump stickers on the bumper along Garden Highway. 
‚ÄúAbout a couple hours into fishing I heard someone yelling out ‚ÄòF‚Ä?Trump,‚Ä?Lee told KTXL. 
Lee and his son were only about 50 yards from where his truck was parked, near the edge of the river. TRENDING ON 100% Fed Up ",english,2016-11-07T10:20:27.252+02:00,100percentfedup.com,US,25689,"EVIL HILLARY SUPPORTERS Yell ""F*ck Trump""‚Ä¶Burn Truck Of Daddy Fishing With 2 Yr Son Over Of Trump Bumper-Stickers [VIDEO] ¬ª 100percentfedUp.com",0.995,http://100percentfedup.com/wp-content/uploads/2016/11/TRUCK-TORCHED-HILLARY.jpg,0,0,0,0,0,bias,Neutral,,,,,,,,,,,,,,,,,,,,,,,,,,,,,,,,,,,
4d3faf17519cfa46ca754ab8068428818dbb2bf3,0,EdJenner,2016-11-07T22:34:36.822+02:00,YIKES! HILLARY GOES OFF THE RAILS‚Ä¶Pulls A Howard Dean [Video], ,english,2016-11-07T22:34:36.822+02:00,100percentfedup.com,US,25689,YIKES! HILLARY GOES OFF THE RAILS‚Ä¶Pulls A Howard Dean [Video],0,http://conservativeangle.com/wp-content/uploads/2016/11/2521919-thumb.jpg,0,1,0,0,0,bias,Negative,,,,,,,,,,,,,,,,,,,,,,,,,,,,,,,,,,,
7759496d1762e34d0a33db572948fd77df481d1d,0,Shawn Helton,2016-10-29T04:22:00.000+03:00,FBI REDUX: What‚Äôs Behind New Probe into Hillary Clinton Emails?,"
In a stunning turn of events 11 days before the 2016 presidential election, the FBI announced it is reopenning its investigation into Hillary Clinton‚Äôs email server case, by probing newly emerging emails linked to Hillary Clinton. 
‚ÄòNEW PROBE‚Äô‚Ä?The FBI gives Hillary Clinton a second look. (Photo illustraion 21WIRE) 
FBI October Surprise? 
According to reports , in a letter written today, FBI Director James Comey , stated that the FBI has begun a new probe into Hillary Clinton related emails once again. Comey offered scant details about the new probe, but due to an unrelated case, additional classified material may have been mishandled on Clinton‚Äôs personal email server. 
CNBC reported the latest FBI developments, including a passage from Comey‚Äôs letter discussing the new investigation: 
‚ÄúIn previous congressional testimony, I referred to the fact that the Federal Bureau of Investigation (FBI) had completed its investigation of former Secretary Clinton‚Äôs personal email server. Due to recent developments, I am writing to supplement my previous testimony,‚Ä?Comey wrote. 
In connection with an unrelated case, the FBI has learned of the existence of emails that appear to be pertinent to the investigation. I am writing to inform you that the investigative team briefed me on this yesterday, and I agreed that the FBI should take appropriate investigative steps designed to allow investigators to review these emails to determine whether they contain classified information, as well as to assess their importance to our investigation,‚Ä?he added. 
Although the FBI cannot yet assess whether or not this material may be significant, and I cannot predict how long it will take us to complete this additional work, I believe it is important to update your Committees about our efforts in light of my previous testimony,‚Ä?Comey concluded.‚Ä?
Huma‚Äôs Estranged ‚ÄòSexting‚Ä?Husband 
According to a new report released via The New York Times : 
‚ÄúThe presidential campaign was rocked on Friday after federal law enforcement officials said that emails pertinent to the now-closed investigation into Hillary Clinton ‚Äôs private email server were discovered on a computer belonging to Anthony D. Weiner, the estranged husband of a top Clinton aide.‚Ä?‚Ä?In a letter to Congress , the F.B.I. director, James B. Comey, said the emails had surfaced in an unrelated case, which law enforcement officials said was an F.B.I. investigation into illicit text messages from Mr. Weiner to a 15-year-old girl in North Carolina. Mr. Weiner, a former Democratic congressman from New York, is married to Huma Abedin, the top aide.‚Ä?Comey has come under fire recently for apparently letting Clinton off the hook for mishandling, and lying to Congress, about classified emails coming through her ‚Äòhome brew‚Ä?email server while she was Secretary of State. After previously closing the case, Comey has done a U-turn and is now saying the FBI will review the new emails to for classified information, and see whether it was mishandled. 
This unprecedented investigative move comes just two days after a Wikileaks docu-dump revealed a memo containing detailed financial information between Clinton Foundation donors and former president Bill Clinton ‚Äòs private financial activities. Among those included in the memo, was a $30 million dollar business arrangement under ‚ÄúBill Clinton, Inc.,‚Ä?with another $66 million dollar deal scheduled over nine years. 
The following is a tweet from Brad Jaffy of NBC Nightly News containing the new FBI recommendation‚Ä?
The new investigation into the Clinton camp will most certainly spark new ‚ÄòPay-to-Play‚Ä?allegations , as the new FBI revelations also comes days after a Project Veritas hidden camera sting operation revealed that the Democratic consultant Robert Creamer of Democracy Partners, discussed ways to commit ‚Äòlarge-scale‚Ä?voter fraud as well as paying political agitators to cause violence at Donald Trump rallies. Out of Creamer‚Äôs 342 visits to the White House, also included his wife, a 9-term Illinois Democratic congresswoman, Jan Schakowsky some 47 times. White House visitor records show that Schakowsky took 47 ‚Äúprivate meetings with Obama or his senior staff,‚Ä?also over the past year. The consultancy Democracy Partners appears to have applied Schakowsky as a political buffering point, possibly in the event of a fallout over their operations at a grassroots level. The impetus of this type of procedural separation is to keep certain high-ranking officials of the hook in case of a massive upheaval over various underhanded campaign tactics ‚Ä?thus giving a political campaign or political entity plausible deniability. ‚ÄòCAUGHT ON FILM‚Ä?‚Ä?Robert Creamer resigns over a massive Democratic Party controversy. (Image Source: CNN ) Creamer, a convicted felon , (in 2005, Creamer plead guilty $2.3 million in bank fraud and tax violations) was promptly ‚Äúshoved out of the Hillary Clinton campaign‚Äôs inner circle,‚Ä?following a heavily publicized video sting revealing his discussion about voter fraud and violence at Trump rallies. ‚ÄòPAY TO PLAY?‚Äô‚Ä?Virginia Governor Terry McAuliffe closely allied with the Clinton‚Äôs negotiated a a campaign contribution involving the FBI. (Image Source new republic ) It remains unclear what exactly reopened the new Clinton probe, but perhaps the FBI had its own cobwebs to clear out after it was revealed that a longtime Clinton associate , Virginia Gov. Terry McAuliffe , ‚Äúhelped steer $675,000 to the election campaign of the wife of an FBI official who went on to lead the probe into Hillary Clinton‚Äôs use of a private email system, according to a report.‚Ä?The NY Post also reported on the matter this past week: 
‚ÄúThe political action committee of McAuliffe, the Clinton loyalist, gave $467,500 to the state Senate campaign of the wife of Andrew McCabe, who is now deputy director of the FBI, according to the Wall Street Journal . 
The report states Jill McCabe received an additional $207,788 from the Virginia Democratic Party, which is heavily influenced by McAuliffe. 
The money directed by McAuliffe began flowing two months after the FBI investigation into Clinton began in July 2015. Around that time, the candidate‚Äôs husband was promoted from running the Washington field office for the FBI to the No. 3 position at the bureau.‚Ä?
In a CNN report from October 18th, a week before the McAuliffe revelations, ‚Äú‚Ä¶According to notes from interviews conducted during an FBI investigation into Clinton‚Äôs email practices, Undersecretary of State Patrick Kennedy personally tried to convince FBI officials that the email should be declassified. One interviewee described feeling ‚Äúpressured‚Ä?by another FBI official at Kennedy‚Äôs request.‚Ä?
The newly reopened FBI investigation into Clinton could be related to all or some of the items listed above, but there‚Äôs no doubt that due to public backlash the FBI received following the first Clinton investigation, in addition to concerns over dealings between the FBI and Clinton associates ‚Ä?the agency needed to save face. 
It remains to be seen how new case will impact the US Presidential election. 
More from RT below‚Ä?",english,2016-10-30T04:16:06.492+02:00,21stcenturywire.com,US,,FBI REDUX: What‚Äôs Behind New Probe into Hillary Clinton Emails?,0,http://21stcenturywire.com/wp-content/uploads/2016/10/Clinton-New-FBI-Probe-21WIRE-SLIDER-New.jpg,0,0,0,0,0,conspiracy,Negative,,,,,,,,,,,,,,,,,,,,,,,,,,,,,,,,,,,
