uuid,ord_in_thread,author,published,title,text,language,crawled,site_url,country,domain_rank,thread_title,spam_score,main_img_url,replies_count,participants_count,likes,comments,shares,type,Neutral,,,,,,,,,,,,,,,,,,,,,,,,,,,,,,,,,,,
97b1c7d89d0c2856afb7d729ad79038ea88b6943,0,Alex Ansary,2016-11-05T00:33:12.210+02:00,üö®Bill Clinton and Hillary Lolita Express Pedophilia Ringüö®,"üö®Bill Clinton and Hillary Lolita Express Pedophilia Ringüö® 11/04/2016 In today‚Äôs video, Christopher Greene of AMTV breaks down the connection between convicted felon Jefferey Epstein ‚Äòknown pedophile‚Ä?and the Clinton‚Äôs. Will this be the next shoe to drop in the Wikileaks Podesta dump? Will find out this weekend in an Exclusive RT interview with the man himself Julian Assange. Analyst: Most Americans like neither Candidate 11/04/2016 PRESS TV US Democratic presidential candidate Hillary Clinton‚Äôs unpopularity among American voters has reached a new h ... Crack in Earth‚Äôs magnetic shield detected 11/04/2016 DNA INDIA The world's largest and most sensitive cosmic ray monitor, located in India, has recorded a burst of galact ... Feds warn NYC officials about possible al Qaeda attack 11/04/2016 NEW YORK POST New York City law enforcement authorities are on high alert after receiving a warning by the feds about ... AMTV Archives",english,2016-11-05T00:33:12.210+02:00,amtvmedia.com,US,,üö®Bill Clinton and Hillary Lolita Express Pedophilia Ringüö®,0,http://www.amtvmedia.com/wp-content/uploads/2016/11/^F04EF997486A3AE26ADE33989E218081943C7C111A00E83658^pimgpsh_fullsize_distr.jpg,0,1,0,0,0,bs,Negative,,,,,,,,,,,,,,,,,,,,,,,,,,,,,,,,,,,
513893b7169c720d7685813c4a174b3a514b2585,0,Alex Ansary,2016-11-07T02:09:03.024+02:00,Opinion: Hillary is the Whore of Babylon and is not Human,"Opinion: Hillary is the Whore of Babylon and is not Human 11/06/2016 
TRACY TWYMAN 
I put some of this information in an article I published yesterday morning about a larger subject. Today I have decided to isolate these segments and add more for a comprehensive piece on the subject because other relevant information has emerged. 
People in the FBI think Hillary Clinton is the Anti-Christ . They are close. She is the Whore of Babylon. 
Hillary was born in 1948, supposedly. I looked for this information on a hunch, after noticing several clues. And sure enough, back in 2008, someone on David Icke‚Äôs forum speculated that Hillary may have been the ‚ÄúMoonchild‚Ä?that, according to artist Marjorie Cameron , was implanted into her own womb by rocket scientist, occultist, and Crowley associate Jack Parsons during a ritual called the ‚Ä?Babalon Working .‚Ä?The purpose was to birth a child to be an incarnation of what Crowley called ‚Ä?Babalon ,‚Ä?the Scarlet Whore with the cup of blood foretold in St. John‚Äôs Revelation that rides the Beast. 
Cameron actually claimed that this fetus, after being taken from her womb, was delivered to people involved in the military‚Äôs nuclear weapons progranm, who were apparently in cahoots with Parsons, and placed inside of a nuclear bomb that was tested. But the fetus ‚Äúsurvived,‚Ä?she said, because it had been placed inside of a special canister made exactly for this purpose. For the 1945 ‚ÄúTrinity‚Ä?bomb test they made a special canister called ‚ÄúJumbo‚Ä?that was supposed to to preserve the plutonium if the bomb did failed to go off. They reportedly didn‚Äôt end up using it for that, but it has been suggested that this is what preserved the fetus of the Moonchild. Presumably, it grew up to be somebody. 
Crowley named one of his female consorts (who he always called his ‚ÄúScarlet Women‚Ä? ‚ÄúHilarion.‚Ä?Her name was Jeanne Foster. Crowley‚Äôs attempt to conceive an heir as a ‚Äúmagical child‚Ä?with Hilarion resulted, supposedly, in the child‚Äôs spirit being attached to his protege Charles Stanfield Jones back in 1909. The ‚Äúattachment‚Ä?allegedly occurred when Jones went through the ritual for ‚ÄúCrossing the Abyss‚Ä?in the 11th degree of the O.T.O., which involves being ritually sodomized by everyone in the group. 
Jack Parsons, another person who had willingly subjected himself to this ritual, channeled The Book of the Antichrist in 1949, where he foretold: 
And within seven years of this time, BABALON, THE SCARLET WOMAN HILARION will manifest among ye, and bring this my work to its fruition. 
I also believe that Hillary, with her notorious cracking voice, and possibly her rival Trump, were foretold in another document channeled by Parsons, the Book of Babalon : 
Her voice is sure as the judgement trump to crack the house of wrong, Though walls are high and stone is hard and the rule of hell was long The gates shall fall and the irons break in the Birth of BABALON. 
In Rome the Hilaria was a festival to the goddess Cybele (worshipped in the form of a black meteorite stone) to celebrate the ‚Äúresurrection‚Ä?of her son, who, as the legend states, she had been having sex with. She then became jealous of his love of others, castrated him, and let him die of bleeding (the reason why all of her priests, the Galli, were castrated, and actually considered women). She later regretted this and caused him to be brought back to life, then forced everyone under her rule to celebrate by laughing and partying joyously, as commemorated in this festival. Consider this next time you notice Hillary Clinton laughing ‚Äúinappropriately.‚Ä?
Also note that Hillary Clinton has made several self-depricating jokes about herself being ‚Ä?not even human ‚Ä?and ‚Äúshort-circuiting‚Ä?when she gets herself twisted up in her own lies. Specifically, in October 2015, when her interviewer at Buzzfeed noted that she seemed to not be sweating, even though it was a hot day (odd, because Hillary has notoriously bad B.O.), she asked Hillary what kind of deodorant she used. Clinton‚Äôs reply was astounding. 
You guys are the first to realize that I‚Äôm really not even a human being. I was constructed in a garage in Palo Alto a very long time ago‚Ä?I mean, a man whose name shall remain nameless created me in his garage. 
Palo Alto is the location of Stanford University, Jack Parsons‚Ä?Alma Mater.",english,2016-11-07T02:09:03.024+02:00,amtvmedia.com,US,,Opinion: Hillary is the Whore of Babylon and is not Human,0,http://www.amtvmedia.com/wp-content/uploads/2016/11/whore-667x381.jpg,0,1,0,0,0,bs,Negative,,,,,,,,,,,,,,,,,,,,,,,,,,,,,,,,,,,
3144f77474072fe03b136d63e83a472b35dec307,0,Alex Ansary,2016-11-07T20:01:08.775+02:00,Hillary Clinton in lead a day before Election Day,"Hillary Clinton in lead a day before Election Day 11/07/2016 
PRESS TV 
Democratic presidential nominee Hillary Clinton leads her Republican rival by three percentage points nationally as they head into the final day of a tight race for the White House, according to a new poll. 
The final Bloomberg Politics-Selzer & Co poll released on Monday has Clinton ahead of Trump, 44 percent to 41 percent. 
Libertarian candidate Gary Johnson was at 4 percent and Green Party candidate Jill Stein had 2 percent support. 
Clinton also leads Trump by three points in a hypothetical two-way matchup when third-party candidates are not included. 
Another tracking poll released early on Monday also put Clinton in the lead. 
The former secretary of state held a four-point lead over the billionaire businessman in the latest ABC News/Washington Post poll. The survey showed 47 percent of likely US voters backed Clinton while 43 percent said they supported Trump. 
The Clinton campaign received a late break with FBI Director James Comey announcing Sunday that no criminal charges were forthcoming in the probe of Clinton‚Äôs newly-found emails. 
‚ÄúBased on our review, we have not changed our conclusions that we expressed in July,‚Ä?the FBI chief wrote in a new letter to congressional committee chairmen. 
The development is a major relief to Clinton, who is spending the final hours of her campaign trying to close Trump‚Äôs path to presidency. Donald Trump walks off the stage after holding a rally at Loudoun Fairgrounds in Leesburg, Virginia, early in the morning on November 7, 2016. (Photo by AFP) 
Comey sent the presidential race into a frenzy last month when he sent a letter to Congress saying the FBI had discovered emails in a separate probe that could be linked to the investigation into Clinton‚Äôs use of a private server when she was secretary of state. 
The surprise move infuriated Democrats and lifted the presidential hopes of Trump, who has turned the email controversy into a favorite line of attack against Clinton. 
Still, Trump continued to seize on the email issue, insisting that Clinton is ‚Äúguilty.‚Ä?
‚ÄúHillary Clinton is guilty. She knows it, the FBI knows it, the people know,‚Ä?he said Sunday at a rally in Detroit, Michigan. ‚ÄúAnd now it‚Äôs up to the American people to deliver justice at the ballot box on November 8.‚Ä?
Both Clinton and Trump plan to spend the last day of the campaign racing across key battleground states that could determine the results of Tuesday‚Äôs election. 
Trump will visit Florida, North Carolina, Pennsylvania, and New Hampshire and finish the day with a rally in Grand Rapids, Michigan. 
Clinton is travelling to Pennsylvania and Michigan before closing with a midnight-rally in Raleigh, North Carolina.",english,2016-11-07T20:01:08.775+02:00,amtvmedia.com,US,,Hillary Clinton in lead a day before Election Day,0,http://www.amtvmedia.com/wp-content/uploads/2016/11/68dca318-2e7c-455f-980c-64a1ff3d86f5.jpg,0,1,0,0,0,bs,Neutral,,,,,,,,,,,,,,,,,,,,,,,,,,,,,,,,,,,
1952f74ad6fd40a47501b5e055b3c596ee0147be,0,hqanon,2016-10-27T03:00:00.000+03:00,‚ÄòDillary Trumplon‚Ä? This Guy‚Äôs Epic Rap Song Just Destroyed Trump AND Hillary,"By Nick Bernabe at theantimedia.org
The 2016 election has been one for the record books. Somehow, two of the most reviled people in the United States have become the frontrunners for the most powerful job in the country ‚Ä?and the world.
On one hand, there is Donald Trump , the compulsively lying demagogic womanizing egomaniacal billionaire. On the other hand, there is Hillary Clinton, the infinitely corrupt influence peddling war-starter who allegedly cheated her way to the top of the Democratic Party while leaving a number of victims in her wake.
A significant portion of young people would actually prefer that a giant, apocalyptic meteor hit the earth rather than see Hillary Clinton or Donald Trump elected president.
It‚Äôs not all bad, though ‚Ä?at least when it comes to the creative art that has been inspired by this nightmare of an election. One such example is ‚ÄúDillary Trumplon,‚Ä?a recently released rap song written and performed by Blaise Guerra that‚Äôs starting to go viral on social media. From Trump‚Äôs demagoguery to Hillary‚Äôs war mongering, Guerra leaves no stone unturned.
Listen to the song for yourself, then check out our interview with Blaise below (his responses have been slightly edited and condensed for clarity).
AM: What inspired you to make this song? Blaise: I was inspired to make the song because I felt very disenfranchised by the way Bernie Sanders sparked such an incredible movement but was completely ignored by the media and given no shot. Yet according to Election Justice USA , without the primaries being fixed, Sanders could have won by a landslide. I felt so cheated when he lost. I knew the Democratic establishment had completely undermined the meaning of democracy and stolen the nomination from him.",english,2016-10-28T01:10:35.172+03:00,anonhq.com,US,12993,‚ÄòDillary Trumplon‚Ä? This Guy‚Äôs Epic Rap Song Just Destroyed Trump AND Hillary,0,http://anonhq.com/wp-content/uploads/2016/10/dillary-trumplon.jpg,0,1,0,0,0,bs,Negative,,,,,,,,,,,,,,,,,,,,,,,,,,,,,,,,,,,
c29887688c1207bd2eafeabd32b41f669ea03681,0,hqanon,2016-10-27T03:00:00.000+03:00,Hillary Admits In Leaked Email That Clinton Donors Are Funding ISIS,"By Alice Salles at theantimedia.org
In an email between Democratic presidential candidate Hillary Clinton and her campaign chairman, John Podesta, the former first lady and secretary of state cites ‚Ä?Western intelligence, US intelligence and sources in the region ‚Ä?to accuse Qatar and Saudi Arabia of ‚Ä?providing clandestine financial and logistic support to ISIL [or ISIS] and other radical Sunni groups in the region .‚Ä?Citing the need to ‚Ä?use our diplomatic and more traditional intelligence assets ,‚Ä?the candidate told Podesta the current developments in the Middle East were ‚Ä?important to the U.S. for reasons that often differ from country to country .‚Ä?In the same email, Clinton seemed to claim Turkey needed to be reassured of America‚Äôs willingness to ‚Ä?take serious actions, ‚Ä?an effort that ‚Ä?[could] be sustained to protect our national interests ‚Ä?in the region.
In another piece of correspondence from 2012, the Director of Foreign Policy at the Clinton Foundation, Amitabh Desai , claimed the Ambassador from Qatar would ‚Ä?like to see [Bill Clinton] ‚Äòfor five minutes‚Ä?in NYC, to present $1 million check that Qatar promised for [his] birthday in 2011 ,‚Ä?adding that the small but rich nation occupying the Qatar Peninsula would ‚Ä?welcome [the Clinton Foundation‚Äôs] suggestions for investments in Haiti ‚Ä?particularly on education and health .‚Ä?Desai added that while Qatar had already ‚Ä?allocated most of their $20 million ‚Ä?[they were] happy to consider projects we suggest .‚Ä?Al Jazeera , a Qatar-based, state-funded news organization, recently ran a list of ‚Ä?revealing, juicy and quirky emails ‚Ä?leaked by WikiLeaks. In its list, the news organization went over the ‚Äúpay-for-play‚Ä?scheme involving the Clinton Foundation, going so far as to mention an email confirming the king of Morocco offered $12m ‚Äúfor the endowment‚Ä?‚Ä?as long as Clinton was willing to take part in a meeting.
Nevertheless, the state-funded broadcaster failed to bring up the Qatar connection. Unfortunately for the organization, Wikileaks promptly noticed the omission.
In a post on Facebook , the WikiLeaks official page said, ‚Ä?Al Jazeera‚Äôs list of juiciest Wikileaks forgets to mention the revelation that Qatar funds both ISIS & Bill Clinton. ‚Ä?On Twitter, the convenient lapse wasn‚Äôt forgiven. Promptly after WikiLeaks pointed out the omission, users began pressuring Al Jazeera to explain why the publication failed to link Qatar to ISIS and Clinton.",english,2016-10-28T01:11:01.168+03:00,anonhq.com,US,12993,Hillary Admits In Leaked Email That Clinton Donors Are Funding ISIS,0,http://anonhq.com/wp-content/uploads/2016/10/14813683_1467449626616981_1381731532_n.jpg,0,1,0,0,0,bs,Negative,,,,,,,,,,,,,,,,,,,,,,,,,,,,,,,,,,,
4513dd3c19e5e13c68aa94a10f38257d085d3e97,0,hqanon,2016-10-27T03:00:00.000+03:00,BREAKING: Irrefutable Proof Obama Lied to Protect Hillary Clinton‚Äôs Run for the White House Read,"By Claire Bernish at theantimedia.org
Thanks to Wikileaks, we now have the smoking gun email irrefutably proving not only did President Barack Obama know about Hillary Clinton‚Äôs non-government-issued email account, he used it in correspondence with her.
Even more damning to the president‚Äôs credibility, it appears the lie was a purposeful attempt to protect Clinton‚Äôs upcoming bid for the presidency.
Shortly after the New York Times broke the story on March 2, 2015, of Clinton‚Äôs use of a personal server to supplant the government system ‚Ä?and, as has been revealed, to thwart transparency ‚Ä?Obama announced publicly his lack of prior knowledge.
‚ÄúThe same time everybody else learned it through news reports,‚Ä?the president told CBS News White House correspondent Bill Plante, as Zero Hedge reported . ‚ÄúThe policy of my administration is to encourage transparency, which is why my emails, the BlackBerry I carry around, all those records are available and archived.
‚ÄúI‚Äôm glad that Hillary‚Äôs instructed that those emails about official business need to be disclosed.‚Ä?It wouldn‚Äôt be a stretch to imagine, however, Obama‚Äôs placid public appearance guarded secret internal panic ‚Ä?a panic echoed behind the scenes at the burgeoning Clinton campaign.
An email penned by Clinton campaign spokesman Josh Schwerin to Director of Communications, Jennifer Palmieri, and a few others, calling immediate attention to a tweet by journalist Katherine Miller paints an entirely different picture.
Miller tweeted a snippet of the aforementioned interview in which Plante asked Obama, ‚ÄúMr. President, When did you first learn that Hillary Clinton used an email system outside the U.S. Government for official business while she was Secretary of State?‚Ä?‚ÄúThe same time everybody else learned it,‚Ä?he responded, ‚Äúthrough news reports.‚Ä?I have some questions here pic.twitter.com/ufkeoZCx2m",english,2016-10-28T01:11:03.164+03:00,anonhq.com,US,12993,BREAKING: Irrefutable Proof Obama Lied to Protect Hillary Clinton‚Äôs Run for the White House Read,0,http://anonhq.com/wp-content/uploads/2016/10/Screen-Shot-2016-10-25-at-1.49.01-PM-660x330.jpg,0,1,0,0,0,bs,Negative,,,,,,,,,,,,,,,,,,,,,,,,,,,,,,,,,,,
e400c4fa1c0dbf380fedc97c5f05ad4395d2dc5f,0,hqanon,2016-10-29T03:00:00.000+03:00,Hillary: Leaked Audio of Her Discussing Rigging an Election in Palestine,"On September 5, 2006, Eli Chomsky was an editor and staff writer for the Jewish Press, and Hillary Clinton was running for a shoo-in re-election as a U.S. senator. Her trip making the rounds of editorial boards brought her to Brooklyn to meet the editorial board of the Jewish Press.",english,2016-10-30T00:07:16.422+03:00,anonhq.com,US,12993,Hillary: Leaked Audio of Her Discussing Rigging an Election in Palestine,0,http://anonhq.com/wp-content/uploads/2016/10/Comp-1_431098-1000x600.jpg,0,1,0,0,0,bs,Negative,,,,,,,,,,,,,,,,,,,,,,,,,,,,,,,,,,,
7c623df2e9a5dd8e35618d7802fa2045f8a04530,0,William J. Astore,2016-10-30T20:13:55.035+02:00,Two Points About the Hillary Clinton Email Fiasco,"Much is being made of Hillary Clinton‚Äôs private email server, which she used when she was Secretary of State. To me, the real issue is not that Hillary endangered national security by sending classified information in the clear. No ‚Ä?the real issue is that the Clintons act as if they are above the rules and laws that apply to ‚Äúthe little people.‚Ä?They are superior and smug, totally devoted to themselves and their pursuit of power and the privileges that come with it. It‚Äôs a matter of character, in other words. Hillary‚Äôs evasiveness, her lack of transparency, her self-righteousness, her strong sense of her own rectitude, make her a dangerous candidate for the presidency.
My second point is this: The issue of classification should be turned on its head. The real issue is not that Hillary potentially revealed secrets. No ‚Ä?the real issue is that our government keeps far too much from us. Our government uses security classification not so much to keep us safe, but to keep the national security state safe ‚Ä?safe from the eyes of the American people.

As The Guardian reported in 2013 :
‚ÄúA committee established by Congress, the Public Interest Declassification Board, warned in December that rampant over-classification is ‚Äòimped[ing] informed government decisions and an informed public‚Ä?and, worse, ‚Äòenabl[ing] corruption and malfeasance‚Ä? In one instance it documented, a government agency was found to be classifying one petabyte of new data every 18 months, the equivalent of 20m filing cabinets filled with text.‚Ä?Nowadays, seemingly everything is classified. And if it‚Äôs classified, if it‚Äôs secret, we can‚Äôt know about it. Because we can‚Äôt be trusted with it. That‚Äôs a fine idea for an autocracy or dictatorship, but not so fine for a democracy.
Government of the people, by the people, for the people? Impossible when nearly everything of any importance is classified.
Too bad Hillary didn‚Äôt send everything in the clear ‚Ä?what a service she would have done for the American people and for democracy!
William J. Astore is a retired lieutenant colonel (USAF). He taught history for fifteen years at military and civilian schools and blogs at Bracing Views . He can be reached at wastore@pct.edu . Reprinted from Bracing Views with the author‚Äôs permission. 
",english,2016-10-30T20:13:55.035+02:00,antiwar.com,US,48959,Two Points About the Hillary Clinton Email Fiasco,0,,0,1,0,0,0,bs,Neutral,,,,,,,,,,,,,,,,,,,,,,,,,,,,,,,,,,,
